,Name ,Comment ,comments,Time ,text_token,text_string
152,Moamenla Jamir,I'm proud that you accepted what you have been through during this journey of boxing and realized what you were losing your family  little by little. It's a very mature thing you spoke about  this and let us know  what you genuinely feel. Only failure can led you to succeed one day by learning and realizing things sooner... Always put God first and your family  loved once than yourself. Wish to see more fun contents and see you guys have a wonderful time because  that's what  the ACE family  wants 💓💓💓 lots of love from India.,i'm proud that you accepted what you have been through during this journey of boxing and realized what you were losing your family  little by little. it's a very mature thing you spoke about  this and let us know  what you genuinely feel. only failure can led you to succeed one day by learning and realizing things sooner... always put god first and your family  loved once than yourself. wish to see more fun contents and see you guys have a wonderful time because  that's what  the ace family  wants 💓💓💓 lots of love from india.,2022-09-14T02:39:01Z,"['proud', 'accepted', 'journey', 'boxing', 'realized', 'losing', 'family', 'little', 'little', 'mature', 'thing', 'spoke', 'let', 'us', 'know', 'genuinely', 'feel', 'failure', 'led', 'succeed', 'one', 'day', 'learning', 'realizing', 'things', 'sooner', 'always', 'put', 'god', 'first', 'family', 'loved', 'wish', 'see', 'fun', 'contents', 'see', 'guys', 'wonderful', 'time', 'ace', 'family', 'wants', 'lots', 'love', 'india']",proud accepted journey boxing realized losing family little little mature thing spoke let know genuinely feel failure led succeed one day learning realizing things sooner always put god first family loved wish see fun contents see guys wonderful time ace family wants lots love india
153,omarx03x23,That boy Gib knocked him down so hard he’s really thinking about life now,that boy gib knocked him down so hard he’s really thinking about life now,2022-09-15T02:32:47Z,"['boy', 'gib', 'knocked', 'hard', 'really', 'thinking', 'life']",boy gib knocked hard really thinking life
154,Don't read profile photo,"He really knocked some sense into him literally. don’t forget where you were and how you started and easily can lose it all, always stay humble.","he really knocked some sense into him literally. don’t forget where you were and how you started and easily can lose it all, always stay humble.",2022-09-15T20:48:10Z,"['really', 'knocked', 'sense', 'literally', 'forget', 'started', 'easily', 'lose', 'always', 'stay', 'humble']",really knocked sense literally forget started easily lose always stay humble
155,Umisunderstood _,knocked out so hard he's understanding what life's all about 🤣 so funny. All that smack talking really bit you in the ass and face 😮,knocked out so hard he's understanding what life's all about 🤣 so funny. all that smack talking really bit you in the ass and face 😮,2022-09-15T00:35:49Z,"['knocked', 'hard', 'understanding', 'life', 'funny', 'smack', 'talking', 'really', 'bit', 'ass', 'face']",knocked hard understanding life funny smack talking really bit ass face
156,John Nguyen,"lmao this man only has been in two boxing fights and its already ""affecting"" his family, shows that this whole boxing thing was a joke","lmao this man only has been in two boxing fights and its already ""affecting"" his family, shows that this whole boxing thing was a joke",2022-09-15T02:38:51Z,"['lmao', 'man', 'two', 'boxing', 'fights', 'already', 'affecting', 'family', 'shows', 'whole', 'boxing', 'thing', 'joke']",lmao man two boxing fights already affecting family shows whole boxing thing joke
157,Aliyah V.,"He really knocked some sense into him literally. don’t forget where you were and how you started and easily can lose it all, always stay humble.","he really knocked some sense into him literally. don’t forget where you were and how you started and easily can lose it all, always stay humble.",2022-09-14T03:23:42Z,"['really', 'knocked', 'sense', 'literally', 'forget', 'started', 'easily', 'lose', 'always', 'stay', 'humble']",really knocked sense literally forget started easily lose always stay humble
158,desiree drouaillet,Give it up for gib👏🏻👏🏻 For being so humble and true throughout everything not giving excuses at all,give it up for gib👏🏻👏🏻 for being so humble and true throughout everything not giving excuses at all,2022-09-15T02:55:44Z,"['give', 'gib', 'humble', 'true', 'throughout', 'everything', 'giving', 'excuses']",give gib humble true throughout everything giving excuses
159,Kyle Allen Music,Jerry finally passing gives me some peace. Chronenberg was a really messed up timeline. Jerry saying their minds may be trapped under their monster bodies gave me chills. Really excited to see where the series goes from here! I've looped all 5 seasons probably 30+ times now.,jerry finally passing gives me some peace. chronenberg was a really messed up timeline. jerry saying their minds may be trapped under their monster bodies gave me chills. really excited to see where the series goes from here! i've looped all 5 seasons probably 30+ times now.,2022-09-14T07:27:11Z,"['jerry', 'finally', 'passing', 'gives', 'peace', 'chronenberg', 'really', 'messed', 'timeline', 'jerry', 'saying', 'minds', 'may', 'trapped', 'monster', 'bodies', 'gave', 'chills', 'really', 'excited', 'see', 'series', 'goes', 'looped', '5', 'seasons', 'probably', '30', 'times']",jerry finally passing gives peace chronenberg really messed timeline jerry saying minds may trapped monster bodies gave chills really excited see series goes looped seasons probably times
160,Dustin Zacharias,"Love how comedically unpredictable the other Rick is. 
“Here’s a bunch of count downs, one of them is probably accurate.”","love how comedically unpredictable the other rick is. 
“here’s a bunch of count downs, one of them is probably accurate.”",2022-09-14T05:52:18Z,"['love', 'comedically', 'unpredictable', 'rick', 'bunch', 'count', 'downs', 'one', 'probably', 'accurate']",love comedically unpredictable rick bunch count downs one probably accurate
161,Big Bear,"Rick's first instinct when the murder bots show up was to shield Morty and get him to safety. He won't admit it even to himself, but he cares for his new family.","rick's first instinct when the murder bots show up was to shield morty and get him to safety. he won't admit it even to himself, but he cares for his new family.",2022-09-14T05:55:55Z,"['rick', 'first', 'instinct', 'murder', 'bots', 'show', 'shield', 'morty', 'get', 'safety', 'admit', 'even', 'cares', 'new', 'family']",rick first instinct murder bots show shield morty get safety admit even cares new family
162,AACMBirdzilla23,"This might be a small detail, but I like when the family goes to get their Jerry back, even Space Beth says hi to him, it may not seem like a lot, but I feel it was nice that even her, the one that suppostly didn't cared for her family, but mainly Jerry, is glad to see him again","this might be a small detail, but i like when the family goes to get their jerry back, even space beth says hi to him, it may not seem like a lot, but i feel it was nice that even her, the one that suppostly didn't cared for her family, but mainly jerry, is glad to see him again",2022-09-14T10:35:33Z,"['might', 'small', 'detail', 'like', 'family', 'goes', 'get', 'jerry', 'back', 'even', 'space', 'beth', 'says', 'hi', 'may', 'seem', 'like', 'lot', 'feel', 'nice', 'even', 'one', 'suppostly', 'cared', 'family', 'mainly', 'jerry', 'glad', 'see']",might small detail like family goes get jerry back even space beth says may seem like lot feel nice even one suppostly cared family mainly jerry glad see
163,Mr. L,"I love how they confirmed that the Jerry they grabbed from the Daycare, wasn't their Jerry. 😂","i love how they confirmed that the jerry they grabbed from the daycare, wasn't their jerry. 😂",2022-09-13T17:38:06Z,"['love', 'confirmed', 'jerry', 'grabbed', 'daycare', 'jerry']",love confirmed jerry grabbed daycare jerry
164,Keno M2,The growth and the trials the original Jerry went through really made him into a great character. Sucks he's gone.,the growth and the trials the original jerry went through really made him into a great character. sucks he's gone.,2022-09-14T08:15:06Z,"['growth', 'trials', 'original', 'jerry', 'went', 'really', 'made', 'great', 'character', 'sucks', 'gone']",growth trials original jerry went really made great character sucks gone
165,LAW - Tutorials,What a grand way to introduce our new antagonist. How is it possible that this show keeps exceeding expectations? 🤩,what a grand way to introduce our new antagonist. how is it possible that this show keeps exceeding expectations? 🤩,2022-09-14T04:29:06Z,"['grand', 'way', 'introduce', 'new', 'antagonist', 'possible', 'show', 'keeps', 'exceeding', 'expectations']",grand way introduce new antagonist possible show keeps exceeding expectations
166,PepperJackMovies,"Pretty big improvement from seasons 4 and 5. They actually allowed breathing room for emotional moments and plot development between jokes and 4th wall breaks, and Rick wasn’t an invincible god like has been recently","pretty big improvement from seasons 4 and 5. they actually allowed breathing room for emotional moments and plot development between jokes and 4th wall breaks, and rick wasn’t an invincible god like has been recently",2022-09-14T03:52:50Z,"['pretty', 'big', 'improvement', 'seasons', '4', '5', 'actually', 'allowed', 'breathing', 'room', 'emotional', 'moments', 'plot', 'development', 'jokes', '4th', 'wall', 'breaks', 'rick', 'invincible', 'god', 'like', 'recently']",pretty big improvement seasons actually allowed breathing room emotional moments plot development jokes 4th wall breaks rick invincible god like recently
167,Shady Doorags,"15:39 ""Obviously I don't know who I'm talking to here, it's all pre-recorded.""
But his eyes consistently follow C137.","15:39 ""obviously i don't know who i'm talking to here, it's all pre-recorded.""
but his eyes consistently follow c137.",2022-09-14T13:22:18Z,"['15', '39', 'obviously', 'know', 'talking', 'pre', 'recorded', 'eyes', 'consistently', 'follow', 'c137']",obviously know talking pre recorded eyes consistently follow c137
168,Short Edits 4198,"I love how badass Season 1 Jerry got, would have been nice to see him and Rick team up","i love how badass season 1 jerry got, would have been nice to see him and rick team up",2022-09-14T04:02:40Z,"['love', 'badass', 'season', '1', 'jerry', 'got', 'would', 'nice', 'see', 'rick', 'team']",love badass season jerry got would nice see rick team
169,scrowfunk,the show isn't perfect but i love all the subtle details they've been putting into these newer episodes. i really liked how morty held his breath when rick opened up the ship because he thought he was in outer space. in the episode with the space snakes morty didn't do that and started to succumb to the vacuum of space. i also like how jerry immediately knew the name of the boring game morty was talking about while he couldn't even remember it.,the show isn't perfect but i love all the subtle details they've been putting into these newer episodes. i really liked how morty held his breath when rick opened up the ship because he thought he was in outer space. in the episode with the space snakes morty didn't do that and started to succumb to the vacuum of space. i also like how jerry immediately knew the name of the boring game morty was talking about while he couldn't even remember it.,2022-09-14T08:24:28Z,"['show', 'perfect', 'love', 'subtle', 'details', 'putting', 'newer', 'episodes', 'really', 'liked', 'morty', 'held', 'breath', 'rick', 'opened', 'ship', 'thought', 'outer', 'space', 'episode', 'space', 'snakes', 'morty', 'started', 'succumb', 'vacuum', 'space', 'also', 'like', 'jerry', 'immediately', 'knew', 'name', 'boring', 'game', 'morty', 'talking', 'even', 'remember']",show perfect love subtle details putting newer episodes really liked morty held breath rick opened ship thought outer space episode space snakes morty started succumb vacuum space also like jerry immediately knew name boring game morty talking even remember
170,Razor movil,"20:04  The way Jerry and everyone ignores rick when he pretended to not care about them is so cute, like
Yeah, you love us, stop pretending otherwise","20:04  the way jerry and everyone ignores rick when he pretended to not care about them is so cute, like
yeah, you love us, stop pretending otherwise",2022-09-14T04:39:07Z,"['20', '04', 'way', 'jerry', 'everyone', 'ignores', 'rick', 'pretended', 'care', 'cute', 'like', 'yeah', 'love', 'us', 'stop', 'pretending', 'otherwise']",way jerry everyone ignores rick pretended care cute like yeah love stop pretending otherwise
171,Repicheep22,"Is it weird that I feel...genuinely happy for the Smith-Sanchez family? They've been through so much together, and they've grown so much as individuals and as a family. To see them working together as a team, and seeing how much they truly care for each other now, it's...refreshing, especially in a show that at one time billed itself as effectively ""Nihilism the Series."" I see a lot of people bringing up the ""Rick and Morty, 100 years"" line, but to me, this episode is a lot more reminiscent of ""No one is born on purpose, no one belongs anywhere, and everyone's gonna die. Come watch TV with me?"" None of the main family is supposed to be where they are, and they only ""belong"" to each other. The multiverse is a terrible place filled with monsters and maniacs, but damnit if they aren't going to love and care for each other in spite of that. I really hope this new status quo sticks. It's...nice.","is it weird that i feel...genuinely happy for the smith-sanchez family? they've been through so much together, and they've grown so much as individuals and as a family. to see them working together as a team, and seeing how much they truly care for each other now, it's...refreshing, especially in a show that at one time billed itself as effectively ""nihilism the series."" i see a lot of people bringing up the ""rick and morty, 100 years"" line, but to me, this episode is a lot more reminiscent of ""no one is born on purpose, no one belongs anywhere, and everyone's gonna die. come watch tv with me?"" none of the main family is supposed to be where they are, and they only ""belong"" to each other. the multiverse is a terrible place filled with monsters and maniacs, but damnit if they aren't going to love and care for each other in spite of that. i really hope this new status quo sticks. it's...nice.",2022-09-14T04:08:29Z,"['weird', 'feel', 'genuinely', 'happy', 'smith', 'sanchez', 'family', 'much', 'together', 'grown', 'much', 'individuals', 'family', 'see', 'working', 'together', 'team', 'seeing', 'much', 'truly', 'care', 'refreshing', 'especially', 'show', 'one', 'time', 'billed', 'effectively', 'nihilism', 'series', 'see', 'lot', 'people', 'bringing', 'rick', 'morty', '100', 'years', 'line', 'episode', 'lot', 'reminiscent', 'one', 'born', 'purpose', 'one', 'belongs', 'anywhere', 'everyone', 'gonna', 'die', 'come', 'watch', 'tv', 'none', 'main', 'family', 'supposed', 'belong', 'multiverse', 'terrible', 'place', 'filled', 'monsters', 'maniacs', 'damnit', 'going', 'love', 'care', 'spite', 'really', 'hope', 'new', 'status', 'quo', 'sticks', 'nice']",weird feel genuinely happy smith sanchez family much together grown much individuals family see working together team seeing much truly care refreshing especially show one time billed effectively nihilism series see lot people bringing rick morty 100 years line episode lot reminiscent one born purpose one belongs anywhere everyone gonna die come watch none main family supposed belong multiverse terrible place filled monsters maniacs damnit going love care spite really hope new status quo sticks nice
172,J K,"The way you guys have consistently premiered this show for free, especially the April fool's episode, has been epic. Love the non-hostile treatment of your viewers.","the way you guys have consistently premiered this show for free, especially the april fool's episode, has been epic. love the non-hostile treatment of your viewers.",2022-09-13T21:14:03Z,"['way', 'guys', 'consistently', 'premiered', 'show', 'free', 'especially', 'april', 'fool', 'episode', 'epic', 'love', 'non', 'hostile', 'treatment', 'viewers']",way guys consistently premiered show free especially april fool episode epic love non hostile treatment viewers
173,Defile Odds,I like how supportive Beth was when she found out Morty got expelled.,i like how supportive beth was when she found out morty got expelled.,2022-09-14T04:28:55Z,"['like', 'supportive', 'beth', 'found', 'morty', 'got', 'expelled']",like supportive beth found morty got expelled
174,MiscStuff123,"I like that Rick basically assures Morty he matters in 3 seperate ways here. Rick relenting on the space station, the ""childproofing"", and their little talk by the new graves. Rick within a couple scenes shows he cares about Morty's life, safety, and emotional state.","i like that rick basically assures morty he matters in 3 seperate ways here. rick relenting on the space station, the ""childproofing"", and their little talk by the new graves. rick within a couple scenes shows he cares about morty's life, safety, and emotional state.",2022-09-14T16:10:36Z,"['like', 'rick', 'basically', 'assures', 'morty', 'matters', '3', 'seperate', 'ways', 'rick', 'relenting', 'space', 'station', 'childproofing', 'little', 'talk', 'new', 'graves', 'rick', 'within', 'couple', 'scenes', 'shows', 'cares', 'morty', 'life', 'safety', 'emotional', 'state']",like rick basically assures morty matters seperate ways rick relenting space station childproofing little talk new graves rick within couple scenes shows cares morty life safety emotional state
175,WTF15TH15,"I love how we see that the Jerry we've had for a few seasons is the wrong Jerry, and the correct Jerry was found later, only to be bitten by Mr Frundles.","i love how we see that the jerry we've had for a few seasons is the wrong jerry, and the correct jerry was found later, only to be bitten by mr frundles.",2022-09-15T00:27:45Z,"['love', 'see', 'jerry', 'seasons', 'wrong', 'jerry', 'correct', 'jerry', 'found', 'later', 'bitten', 'mr', 'frundles']",love see jerry seasons wrong jerry correct jerry found later bitten frundles
176,Little Magician ,I never realized how terrifying rick is as a concept until this episode that last scene sent chills down my spine,i never realized how terrifying rick is as a concept until this episode that last scene sent chills down my spine,2022-09-14T11:07:19Z,"['never', 'realized', 'terrifying', 'rick', 'concept', 'episode', 'last', 'scene', 'sent', 'chills', 'spine']",never realized terrifying rick concept episode last scene sent chills spine
177,BCshooterFMJ PRIME,"""This EMERGENCY was oversold to me."" Moments like that will always keep me coming back

Great episode. Through and through.","""this emergency was oversold to me."" moments like that will always keep me coming back

great episode. through and through.",2022-09-15T14:49:50Z,"['emergency', 'oversold', 'moments', 'like', 'always', 'keep', 'coming', 'back', 'great', 'episode']",emergency oversold moments like always keep coming back great episode
178,Mewtation Nation,This was one of the best episodes of the entire series in my opinion. It brought so many arcs back into the fold and full circle along with being absolutely hilarious.,this was one of the best episodes of the entire series in my opinion. it brought so many arcs back into the fold and full circle along with being absolutely hilarious.,2022-09-14T09:46:15Z,"['one', 'best', 'episodes', 'entire', 'series', 'opinion', 'brought', 'many', 'arcs', 'back', 'fold', 'full', 'circle', 'along', 'absolutely', 'hilarious']",one best episodes entire series opinion brought many arcs back fold full circle along absolutely hilarious
179,Mrwhosetheboss,"After watching the video - let's chat! Are you impressed or underwhelmed by the iPhone 14 Pro so far?
To see the iPhone 14 Battery test: https://youtu.be/yP3WyefjzaM","after watching the video - let's chat! are you impressed or underwhelmed by the iphone 14 pro so far?
to see the iphone 14 battery test: https://youtu.be/yp3wyefjzam",2022-09-14T13:07:20Z,"['watching', 'video', 'let', 'chat', 'impressed', 'underwhelmed', 'iphone', '14', 'pro', 'far', 'see', 'iphone', '14', 'battery', 'test', 'https', 'youtu', 'yp3wyefjzam']",watching video let chat impressed underwhelmed iphone pro far see iphone battery test https youtu yp3wyefjzam
180,Bows U,The fact that he has to show us the differences by zooming into the pixels in most photos shows that both cameras are incredible and there is no wrong choice for the normal consumer.,the fact that he has to show us the differences by zooming into the pixels in most photos shows that both cameras are incredible and there is no wrong choice for the normal consumer.,2022-09-14T13:21:03Z,"['fact', 'show', 'us', 'differences', 'zooming', 'pixels', 'photos', 'shows', 'cameras', 'incredible', 'wrong', 'choice', 'normal', 'consumer']",fact show differences zooming pixels photos shows cameras incredible wrong choice normal consumer
181,R H,"As an S21 ultra owner I'm glad you mentioned the shutter lag! So many photos of my 1yr old become useless because of the lag.
I'm glad Apple seems to be doing a better job here.","as an s21 ultra owner i'm glad you mentioned the shutter lag! so many photos of my 1yr old become useless because of the lag.
i'm glad apple seems to be doing a better job here.",2022-09-15T13:28:45Z,"['s21', 'ultra', 'owner', 'glad', 'mentioned', 'shutter', 'lag', 'many', 'photos', '1yr', 'old', 'become', 'useless', 'lag', 'glad', 'apple', 'seems', 'better', 'job']",s21 ultra owner glad mentioned shutter lag many photos 1yr old become useless lag glad apple seems better job
182,Dolger,"Honestly I'm extremely excited for the S23 Ultra, they've had such similar hardware for years that it is time for a huge upgrade.","honestly i'm extremely excited for the s23 ultra, they've had such similar hardware for years that it is time for a huge upgrade.",2022-09-15T23:27:48Z,"['honestly', 'extremely', 'excited', 's23', 'ultra', 'similar', 'hardware', 'years', 'time', 'huge', 'upgrade']",honestly extremely excited s23 ultra similar hardware years time huge upgrade
183,Rönny kh,"The amount of work he put in just one video 
The production and in-depth detail mannnnn.
You're the BOSS clearly :D","the amount of work he put in just one video 
the production and in-depth detail mannnnn.
you're the boss clearly :d",2022-09-15T16:55:42Z,"['amount', 'work', 'put', 'one', 'video', 'production', 'depth', 'detail', 'mannnnn', 'boss', 'clearly']",amount work put one video production depth detail mannnnn boss clearly
