,Name ,Comment ,comments,Time ,text_token,text_string
440,Cresce,"Scarr went crazy on this shit 🔥🔥 Scarr hit the feels with this one. Shit inspiring to me as an artist. Ima be on top like Scarr soon. I released my fifth music video in the span of three months recently. Ima keep going hard till i get there. To anyone that checks me out and joins me on this journey to success, I will forever be thankful 🙏","scarr went crazy on this shit 🔥🔥 scarr hit the feels with this one. shit inspiring to me as an artist. ima be on top like scarr soon. i released my fifth music video in the span of three months recently. ima keep going hard till i get there. to anyone that checks me out and joins me on this journey to success, i will forever be thankful 🙏",2022-09-13T19:17:05Z,"['scarr', 'went', 'crazy', 'shit', 'scarr', 'hit', 'feels', 'one', 'shit', 'inspiring', 'artist', 'ima', 'top', 'like', 'scarr', 'soon', 'released', 'fifth', 'music', 'video', 'span', 'three', 'months', 'recently', 'ima', 'keep', 'going', 'hard', 'till', 'get', 'anyone', 'checks', 'joins', 'journey', 'success', 'forever', 'thankful']",scarr went crazy shit scarr hit feels one shit inspiring artist ima top like scarr soon released fifth music video span three months recently ima keep going hard till get anyone checks joins journey success forever thankful
441,Kitty Lillian,Big Scarr go in sooooooo hard on this right here! He aint like all them trappers and oppas who just be usin dat *AUTHENTIC* *VIEWS* dawwwt cawwwm jawwwwn to get they hits up to go HAM... SMH seem like anyone can glow up these days...,big scarr go in sooooooo hard on this right here! he aint like all them trappers and oppas who just be usin dat *authentic* *views* dawwwt cawwwm jawwwwn to get they hits up to go ham... smh seem like anyone can glow up these days...,2022-09-13T17:03:51Z,"['big', 'scarr', 'go', 'sooooooo', 'hard', 'right', 'aint', 'like', 'trappers', 'oppas', 'usin', 'dat', 'authentic', 'views', 'dawwwt', 'cawwwm', 'jawwwwn', 'get', 'hits', 'go', 'ham', 'smh', 'seem', 'like', 'anyone', 'glow', 'days']",big scarr sooooooo hard right aint like trappers oppas usin dat authentic views dawwwt cawwwm jawwwwn get hits ham smh seem like anyone glow days
442,Busby,Every drop is gas. Big Scarr a main stepper for 1017🔥🔥🔥💯🎯☠️,every drop is gas. big scarr a main stepper for 1017🔥🔥🔥💯🎯☠️,2022-09-13T16:05:21Z,"['every', 'drop', 'gas', 'big', 'scarr', 'main', 'stepper', '1017']",every drop gas big scarr main stepper 1017
443,Thebackupone444,He definitely in my top 5 ever since he came out. He been consistent but so underrated 🔥,he definitely in my top 5 ever since he came out. he been consistent but so underrated 🔥,2022-09-13T16:27:33Z,"['definitely', 'top', '5', 'ever', 'since', 'came', 'consistent', 'underrated']",definitely top ever since came consistent underrated
444,neo,Scar has easily taken the top spot in 1017 his music is always on point.,scar has easily taken the top spot in 1017 his music is always on point.,2022-09-13T16:11:26Z,"['scar', 'easily', 'taken', 'top', 'spot', '1017', 'music', 'always', 'point']",scar easily taken top spot 1017 music always point
445,Dv Scarr,Big Scarr the best 1017 💯 maximo respeito 🇧🇷🇧🇷🔥,big scarr the best 1017 💯 maximo respeito 🇧🇷🇧🇷🔥,2022-09-13T19:56:12Z,"['big', 'scarr', 'best', '1017', 'maximo', 'respeito']",big scarr best 1017 maximo respeito
446,Adutch,This man can literally walk through this shit,this man can literally walk through this shit,2022-09-13T17:19:31Z,"['man', 'literally', 'walk', 'shit']",man literally walk shit
447,Ben Frankss,"Scarr so mfn underrated he really got bars. This man don’t even write his lyrics; he just go in the studio, hear the beat and just SNAPPED🔥🥶","scarr so mfn underrated he really got bars. this man don’t even write his lyrics; he just go in the studio, hear the beat and just snapped🔥🥶",2022-09-14T00:12:32Z,"['scarr', 'mfn', 'underrated', 'really', 'got', 'bars', 'man', 'even', 'write', 'lyrics', 'go', 'studio', 'hear', 'beat', 'snapped']",scarr mfn underrated really got bars man even write lyrics studio hear beat snapped
448,T Scott,"“Before I go broke I’ll sleep in a tent!” Big Scarr keep dropping bangers man, and they stay on repeat!","“before i go broke i’ll sleep in a tent!” big scarr keep dropping bangers man, and they stay on repeat!",2022-09-14T02:08:13Z,"['go', 'broke', 'sleep', 'tent', 'big', 'scarr', 'keep', 'dropping', 'bangers', 'man', 'stay', 'repeat']",broke sleep tent big scarr keep dropping bangers man stay repeat
449,Mr don’t play,Them chains ablives  and the way Big Scar ride them beats is epic💯💯,them chains ablives  and the way big scar ride them beats is epic💯💯,2022-09-13T22:04:45Z,"['chains', 'ablives', 'way', 'big', 'scar', 'ride', 'beats', 'epic']",chains ablives way big scar ride beats epic
450,Brandy Crystal,Big Scarr dun went in HAM on this right here!,big scarr dun went in ham on this right here!,2022-09-13T17:03:36Z,"['big', 'scarr', 'dun', 'went', 'ham', 'right']",big scarr dun went ham right
451,The Moultrie’s,Scarr never disappoints me 💪🏾🖤,scarr never disappoints me 💪🏾🖤,2022-09-13T17:00:16Z,"['scarr', 'never', 'disappoints']",scarr never disappoints
452,Izzy May IS ready ,"Scarr went crazy on this shit 🔥🔥 Scarr hit the feels with this one. Shit inspiring to me as an artist. Ima be on top like Scarr soon. I released my fifth music video in the span of three months recently. Ima keep going hard till i get there. To anyone that checks me out and joins me on this journey to success, I will forever be thankful","scarr went crazy on this shit 🔥🔥 scarr hit the feels with this one. shit inspiring to me as an artist. ima be on top like scarr soon. i released my fifth music video in the span of three months recently. ima keep going hard till i get there. to anyone that checks me out and joins me on this journey to success, i will forever be thankful",2022-09-15T23:20:59Z,"['scarr', 'went', 'crazy', 'shit', 'scarr', 'hit', 'feels', 'one', 'shit', 'inspiring', 'artist', 'ima', 'top', 'like', 'scarr', 'soon', 'released', 'fifth', 'music', 'video', 'span', 'three', 'months', 'recently', 'ima', 'keep', 'going', 'hard', 'till', 'get', 'anyone', 'checks', 'joins', 'journey', 'success', 'forever', 'thankful']",scarr went crazy shit scarr hit feels one shit inspiring artist ima top like scarr soon released fifth music video span three months recently ima keep going hard till get anyone checks joins journey success forever thankful
453,Aydenbeta,Been bumping since scarrs live and happy it’s finally out,been bumping since scarrs live and happy it’s finally out,2022-09-14T02:14:02Z,"['bumping', 'since', 'scarrs', 'live', 'happy', 'finally']",bumping since scarrs live happy finally
454,Mr. Johnson,Consistently dropping heat 🔥🔥🔥 another one,consistently dropping heat 🔥🔥🔥 another one,2022-09-13T17:18:54Z,"['consistently', 'dropping', 'heat', 'another', 'one']",consistently dropping heat another one
455,Riley Freeman #JP,Refreshing listening to him he’s unique,refreshing listening to him he’s unique,2022-09-14T07:11:02Z,"['refreshing', 'listening', 'unique']",refreshing listening unique
456,JUNIORCLOTAIRE🎧,BIG SCARR ON FIRE 🔥🔥🔥🔥🔥✊✊,big scarr on fire 🔥🔥🔥🔥🔥✊✊,2022-09-13T17:09:58Z,"['big', 'scarr', 'fire']",big scarr fire
457,Rado.392,Another banger to add to my high speed playlist🫣,another banger to add to my high speed playlist🫣,2022-09-13T17:02:28Z,"['another', 'banger', 'add', 'high', 'speed', 'playlist']",another banger add high speed playlist
458,"Jer ,",This finally dropped I had the leak on repeat🤣🔥🔥🔥,this finally dropped i had the leak on repeat🤣🔥🔥🔥,2022-09-13T16:03:57Z,"['finally', 'dropped', 'leak', 'repeat']",finally dropped leak repeat
459,LAW - Tutorials,Yeah let’s make “50 hours in the world’s largest cave” happen! 😍,yeah let’s make “50 hours in the world’s largest cave” happen! 😍,2022-09-14T04:30:35Z,"['yeah', 'let', 'make', '50', 'hours', 'world', 'largest', 'cave', 'happen']",yeah let make hours world largest cave happen
460,Shelly Shubh,I would love to see jimmy and his friends spending 50 hours in a cave. It would be awesome!,i would love to see jimmy and his friends spending 50 hours in a cave. it would be awesome!,2022-09-14T14:26:54Z,"['would', 'love', 'see', 'jimmy', 'friends', 'spending', '50', 'hours', 'cave', 'would', 'awesome']",would love see jimmy friends spending hours cave would awesome
461,Lisa M. Willson,"I would honestly love to see ""50 hours in the worlds largest cave"". Lets make it happen!","i would honestly love to see ""50 hours in the worlds largest cave"". lets make it happen!",2022-09-14T08:13:15Z,"['would', 'honestly', 'love', 'see', '50', 'hours', 'worlds', 'largest', 'cave', 'lets', 'make', 'happen']",would honestly love see hours worlds largest cave lets make happen
462,10K Subscribers With 0 Video Challenge,Jimmy deserves an award for literally having some of the funniest yet most relatable reactions.,jimmy deserves an award for literally having some of the funniest yet most relatable reactions.,2022-09-14T10:07:13Z,"['jimmy', 'deserves', 'award', 'literally', 'funniest', 'yet', 'relatable', 'reactions']",jimmy deserves award literally funniest yet relatable reactions
463,Dmitri Pitt,"I would honestly love to see ""50 hours in the worlds largest cave"". Lets make it happen!","i would honestly love to see ""50 hours in the worlds largest cave"". lets make it happen!",2022-09-12T21:13:47Z,"['would', 'honestly', 'love', 'see', '50', 'hours', 'worlds', 'largest', 'cave', 'lets', 'make', 'happen']",would honestly love see hours worlds largest cave lets make happen
464,AlphaNguyeen,"As Vietnamese, I would honestly love to see “50 hours in the SƠN ĐOÒNG- The world largest cave” it’s enormous and majestic cave. You will have tons of emotion when you go there, I promise!","as vietnamese, i would honestly love to see “50 hours in the sơn đoòng- the world largest cave” it’s enormous and majestic cave. you will have tons of emotion when you go there, i promise!",2022-09-14T17:27:13Z,"['vietnamese', 'would', 'honestly', 'love', 'see', '50', 'hours', 'sơn', 'đoòng', 'world', 'largest', 'cave', 'enormous', 'majestic', 'cave', 'tons', 'emotion', 'go', 'promise']",vietnamese would honestly love see hours sơn đoòng world largest cave enormous majestic cave tons emotion promise
465,Anurag Kshirsagar,I would also love to see you guys in “50 hours in the worlds largest cave!'',i would also love to see you guys in “50 hours in the worlds largest cave!'',2022-09-14T13:21:09Z,"['would', 'also', 'love', 'see', 'guys', '50', 'hours', 'worlds', 'largest', 'cave']",would also love see guys hours worlds largest cave
466,ROBOT365,"I would love to see jimmy and his friends spending 50 hours in a cave. It would be awesome!
😃","i would love to see jimmy and his friends spending 50 hours in a cave. it would be awesome!
😃",2022-09-16T08:52:15Z,"['would', 'love', 'see', 'jimmy', 'friends', 'spending', '50', 'hours', 'cave', 'would', 'awesome']",would love see jimmy friends spending hours cave would awesome
467,Chase _,i would honestly love to see “50 hours in the worlds largest cave”. lets make it happen !,i would honestly love to see “50 hours in the worlds largest cave”. lets make it happen !,2022-09-14T11:06:06Z,"['would', 'honestly', 'love', 'see', '50', 'hours', 'worlds', 'largest', 'cave', 'lets', 'make', 'happen']",would honestly love see hours worlds largest cave lets make happen
468,dondred belcourt,"I'd watch 50 hours in a cave if it was that cave, looks sweet.","i'd watch 50 hours in a cave if it was that cave, looks sweet.",2022-09-12T21:08:46Z,"['watch', '50', 'hours', 'cave', 'cave', 'looks', 'sweet']",watch hours cave cave looks sweet
469,tobias Borup,"I would honestly love to see ""50 hours in the world's largest cave"". Let's make it happen!","i would honestly love to see ""50 hours in the world's largest cave"". let's make it happen!",2022-09-14T19:56:54Z,"['would', 'honestly', 'love', 'see', '50', 'hours', 'world', 'largest', 'cave', 'let', 'make', 'happen']",would honestly love see hours world largest cave let make happen
470,TTV SwiperAce,"I would honestly love to see ""50 hours in the worlds largest cave"". Lets make it happen!","i would honestly love to see ""50 hours in the worlds largest cave"". lets make it happen!",2022-09-15T17:35:36Z,"['would', 'honestly', 'love', 'see', '50', 'hours', 'worlds', 'largest', 'cave', 'lets', 'make', 'happen']",would honestly love see hours worlds largest cave lets make happen
471,10K Subscribers With 0 Video Challenge,Jimmy deserves an award for literally having some of the funniest yet most relatable reactions.,jimmy deserves an award for literally having some of the funniest yet most relatable reactions.,2022-09-14T10:07:09Z,"['jimmy', 'deserves', 'award', 'literally', 'funniest', 'yet', 'relatable', 'reactions']",jimmy deserves award literally funniest yet relatable reactions
472,Jake Manz,"I would honestly love to see ""50 hours in the world's largest cave"". Let's make it happen","i would honestly love to see ""50 hours in the world's largest cave"". let's make it happen",2022-09-14T06:53:57Z,"['would', 'honestly', 'love', 'see', '50', 'hours', 'world', 'largest', 'cave', 'let', 'make', 'happen']",would honestly love see hours world largest cave let make happen
473,Judah Freeman,I would also love to see you guys in “50 hours in the worlds largest cave!”,i would also love to see you guys in “50 hours in the worlds largest cave!”,2022-09-12T21:48:18Z,"['would', 'also', 'love', 'see', 'guys', '50', 'hours', 'worlds', 'largest', 'cave']",would also love see guys hours worlds largest cave
474,Salar Mohammadi,"I would love to see you guys in a cave for 50 hours, that would be amazing :)","i would love to see you guys in a cave for 50 hours, that would be amazing :)",2022-09-14T11:47:43Z,"['would', 'love', 'see', 'guys', 'cave', '50', 'hours', 'would', 'amazing']",would love see guys cave hours would amazing
475,eazy™,"I would honestly love to see ""50 hours in the worlds largest cave"". Lets make it happen!","i would honestly love to see ""50 hours in the worlds largest cave"". lets make it happen!",2022-09-14T09:07:45Z,"['would', 'honestly', 'love', 'see', '50', 'hours', 'worlds', 'largest', 'cave', 'lets', 'make', 'happen']",would honestly love see hours worlds largest cave lets make happen
476,10K Subscribers With 0 Video Challenge,"I would honestly love to see ""50 hours in the worlds largest cave"". Lets make it happen!","i would honestly love to see ""50 hours in the worlds largest cave"". lets make it happen!",2022-09-14T12:59:58Z,"['would', 'honestly', 'love', 'see', '50', 'hours', 'worlds', 'largest', 'cave', 'lets', 'make', 'happen']",would honestly love see hours worlds largest cave lets make happen
477,10K Subscribers With 0 Video Challenge,"I would honestly love to see ""50 hours in the worlds largest cave"". Lets make it happen!","i would honestly love to see ""50 hours in the worlds largest cave"". lets make it happen!",2022-09-14T12:59:52Z,"['would', 'honestly', 'love', 'see', '50', 'hours', 'worlds', 'largest', 'cave', 'lets', 'make', 'happen']",would honestly love see hours worlds largest cave lets make happen
478,Zeltik,"What do you think about Tears of the Kingdom??

EDIT: the figure seemingly levitating shown on the carvings looks very similar to the ""Zelda"" carving, so it could well be her rather than Ganondorf!","what do you think about tears of the kingdom??

edit: the figure seemingly levitating shown on the carvings looks very similar to the ""zelda"" carving, so it could well be her rather than ganondorf!",2022-09-13T19:16:40Z,"['think', 'tears', 'kingdom', 'edit', 'figure', 'seemingly', 'levitating', 'shown', 'carvings', 'looks', 'similar', 'zelda', 'carving', 'could', 'well', 'rather', 'ganondorf']",think tears kingdom edit figure seemingly levitating shown carvings looks similar zelda carving could well rather ganondorf
479,Zelda Universe,"Excellent job as always Zeltik!

So many chills from this trailer!","excellent job as always zeltik!

so many chills from this trailer!",2022-09-13T21:50:58Z,"['excellent', 'job', 'always', 'zeltik', 'many', 'chills', 'trailer']",excellent job always zeltik many chills trailer
480,Travis,"Something interesting about the 'soldiers'.  Nintendo drew them in such a way to draw attention to the fact that they're all left handed.  Nintendo has been very deliberate about these sorts of design choices in the past (think various incarnations of Link that popped up in the other games, like the Hero's Shade), which leads me to believe that it's probably referring to Link.  I'm not sure if the number of soldiers might infer some sort of relation to his various incarnations, but I think it's likely as well.","something interesting about the 'soldiers'.  nintendo drew them in such a way to draw attention to the fact that they're all left handed.  nintendo has been very deliberate about these sorts of design choices in the past (think various incarnations of link that popped up in the other games, like the hero's shade), which leads me to believe that it's probably referring to link.  i'm not sure if the number of soldiers might infer some sort of relation to his various incarnations, but i think it's likely as well.",2022-09-14T19:13:53Z,"['something', 'interesting', 'soldiers', 'nintendo', 'drew', 'way', 'draw', 'attention', 'fact', 'left', 'handed', 'nintendo', 'deliberate', 'sorts', 'design', 'choices', 'past', 'think', 'various', 'incarnations', 'link', 'popped', 'games', 'like', 'hero', 'shade', 'leads', 'believe', 'probably', 'referring', 'link', 'sure', 'number', 'soldiers', 'might', 'infer', 'sort', 'relation', 'various', 'incarnations', 'think', 'likely', 'well']",something interesting soldiers nintendo drew way draw attention fact left handed nintendo deliberate sorts design choices past think various incarnations link popped games like hero shade leads believe probably referring link sure number soldiers might infer sort relation various incarnations think likely well
481,Alexander Saksvoll,"I love the fact that we will be fighting more physical enemies, other than just Moblins and Bokoblins. In previous clips we have seen some worm-like enemy hanging from the roof of a cave, and at 5:54 we can see a flying enemy, possibly some Aeralfos type of enemy. This is bloody great news!","i love the fact that we will be fighting more physical enemies, other than just moblins and bokoblins. in previous clips we have seen some worm-like enemy hanging from the roof of a cave, and at 5:54 we can see a flying enemy, possibly some aeralfos type of enemy. this is bloody great news!",2022-09-14T12:36:25Z,"['love', 'fact', 'fighting', 'physical', 'enemies', 'moblins', 'bokoblins', 'previous', 'clips', 'seen', 'worm', 'like', 'enemy', 'hanging', 'roof', 'cave', '5', '54', 'see', 'flying', 'enemy', 'possibly', 'aeralfos', 'type', 'enemy', 'bloody', 'great', 'news']",love fact fighting physical enemies moblins bokoblins previous clips seen worm like enemy hanging roof cave see flying enemy possibly aeralfos type enemy bloody great news
482,QuasarEE,"The meditating figure has a lot of sevens in it interestingly. Seven ""locks of hair"" (or whatever those extensions are) to each side. Six extensions off both of its ""ears"", which with its face make another seven. Six ""tear drop"" patterns beneath its eyes (which resemble the Sheikah symbol; Zelda's depiction also shows that pattern; three triangles also draw a natural parallel with the Triforce). Whole lot of symbolism packed in there. I also feel like it might be wearing a mask rather than this depiction being its natural face, since it otherwise seems human.","the meditating figure has a lot of sevens in it interestingly. seven ""locks of hair"" (or whatever those extensions are) to each side. six extensions off both of its ""ears"", which with its face make another seven. six ""tear drop"" patterns beneath its eyes (which resemble the sheikah symbol; zelda's depiction also shows that pattern; three triangles also draw a natural parallel with the triforce). whole lot of symbolism packed in there. i also feel like it might be wearing a mask rather than this depiction being its natural face, since it otherwise seems human.",2022-09-14T01:59:22Z,"['meditating', 'figure', 'lot', 'sevens', 'interestingly', 'seven', 'locks', 'hair', 'whatever', 'extensions', 'side', 'six', 'extensions', 'ears', 'face', 'make', 'another', 'seven', 'six', 'tear', 'drop', 'patterns', 'beneath', 'eyes', 'resemble', 'sheikah', 'symbol', 'zelda', 'depiction', 'also', 'shows', 'pattern', 'three', 'triangles', 'also', 'draw', 'natural', 'parallel', 'triforce', 'whole', 'lot', 'symbolism', 'packed', 'also', 'feel', 'like', 'might', 'wearing', 'mask', 'rather', 'depiction', 'natural', 'face', 'since', 'otherwise', 'seems', 'human']",meditating figure lot sevens interestingly seven locks hair whatever extensions side six extensions ears face make another seven six tear drop patterns beneath eyes resemble sheikah symbol zelda depiction also shows pattern three triangles also draw natural parallel triforce whole lot symbolism packed also feel like might wearing mask rather depiction natural face since otherwise seems human
483,That One Guy Logan,I got major Twili from Twilight Princess vibes. The colour scheme. the symbols. The Twili were originally a tribe of magic users who were banished from Hyrule by the godesses for trying to use the Triorce. Add in the figure being surrounded by the seven tears which you also have to collect tears of light also in twilight princess. I could really go on. The more I think the more I see honestly.,i got major twili from twilight princess vibes. the colour scheme. the symbols. the twili were originally a tribe of magic users who were banished from hyrule by the godesses for trying to use the triorce. add in the figure being surrounded by the seven tears which you also have to collect tears of light also in twilight princess. i could really go on. the more i think the more i see honestly.,2022-09-14T04:30:55Z,"['got', 'major', 'twili', 'twilight', 'princess', 'vibes', 'colour', 'scheme', 'symbols', 'twili', 'originally', 'tribe', 'magic', 'users', 'banished', 'hyrule', 'godesses', 'trying', 'use', 'triorce', 'add', 'figure', 'surrounded', 'seven', 'tears', 'also', 'collect', 'tears', 'light', 'also', 'twilight', 'princess', 'could', 'really', 'go', 'think', 'see', 'honestly']",got major twili twilight princess vibes colour scheme symbols twili originally tribe magic users banished hyrule godesses trying use triorce add figure surrounded seven tears also collect tears light also twilight princess could really think see honestly
484,CZsWorld,It feels like this teaser was created for people like you to analyze. There's more in the subtext than the surface level trailer. I'm glad we got a name though! Tears of the Kingdom. TotK,it feels like this teaser was created for people like you to analyze. there's more in the subtext than the surface level trailer. i'm glad we got a name though! tears of the kingdom. totk,2022-09-13T19:21:13Z,"['feels', 'like', 'teaser', 'created', 'people', 'like', 'analyze', 'subtext', 'surface', 'level', 'trailer', 'glad', 'got', 'name', 'though', 'tears', 'kingdom', 'totk']",feels like teaser created people like analyze subtext surface level trailer glad got name though tears kingdom totk
485,Dave P,I don't know if anyone else has mentioned this but I'm wondering if that figure in the carvings could be the Zonai depiction of Hylia. So the figures with hands cupped to each other could be a representation of the duality of Hylia's life. First as a goddess but then a mortal.,i don't know if anyone else has mentioned this but i'm wondering if that figure in the carvings could be the zonai depiction of hylia. so the figures with hands cupped to each other could be a representation of the duality of hylia's life. first as a goddess but then a mortal.,2022-09-14T14:01:28Z,"['know', 'anyone', 'else', 'mentioned', 'wondering', 'figure', 'carvings', 'could', 'zonai', 'depiction', 'hylia', 'figures', 'hands', 'cupped', 'could', 'representation', 'duality', 'hylia', 'life', 'first', 'goddess', 'mortal']",know anyone else mentioned wondering figure carvings could zonai depiction hylia figures hands cupped could representation duality hylia life first goddess mortal
