,Name ,Comment ,comments,Time ,text_token,text_string
277,Matt Lane,"I remember people being mad about Kingdom Hearts going over to Xbox but for me, as a fan, I was happy. Because I think it’s a great way to let other people try a game you grew up with.","i remember people being mad about kingdom hearts going over to xbox but for me, as a fan, i was happy. because i think it’s a great way to let other people try a game you grew up with.",2022-09-14T04:09:06Z,"['remember', 'people', 'mad', 'kingdom', 'hearts', 'going', 'xbox', 'fan', 'happy', 'think', 'great', 'way', 'let', 'people', 'try', 'game', 'grew']",remember people mad kingdom hearts going xbox fan happy think great way let people try game grew
278,bobby williams,"Hello, it is ME, bobby WILLIAMS. With the night closing in, I must confess that this video brings warmth not even a fire could match. Thank you, Scott, for blessing us with a safety blanket in this world of harm and danger. Your facial is looking good! I've always dug the glasses, so keep that up. Have you ever considered making a Speed Racer-focused video? Perhaps on the Wii game??? I think it would make for a splendid time, especially if you watch the movie. Have you seen Cars On the Road? It's a new Disney+ series starring Lightning McQueen and Mater, and focuses on their cross-country travels. I've only seen the first four episodes, but they're, as Mater would, some ""humdingers."" They're episodic, too, so you can enjoy a nice bowl of cereal with an episode, then go about your Wozniak day.

Thanks for your help and time.

Best regards,

Bobby Williams","hello, it is me, bobby williams. with the night closing in, i must confess that this video brings warmth not even a fire could match. thank you, scott, for blessing us with a safety blanket in this world of harm and danger. your facial is looking good! i've always dug the glasses, so keep that up. have you ever considered making a speed racer-focused video? perhaps on the wii game??? i think it would make for a splendid time, especially if you watch the movie. have you seen cars on the road? it's a new disney+ series starring lightning mcqueen and mater, and focuses on their cross-country travels. i've only seen the first four episodes, but they're, as mater would, some ""humdingers."" they're episodic, too, so you can enjoy a nice bowl of cereal with an episode, then go about your wozniak day.

thanks for your help and time.

best regards,

bobby williams",2022-09-14T03:13:43Z,"['hello', 'bobby', 'williams', 'night', 'closing', 'must', 'confess', 'video', 'brings', 'warmth', 'even', 'fire', 'could', 'match', 'thank', 'scott', 'blessing', 'us', 'safety', 'blanket', 'world', 'harm', 'danger', 'facial', 'looking', 'good', 'always', 'dug', 'glasses', 'keep', 'ever', 'considered', 'making', 'speed', 'racer', 'focused', 'video', 'perhaps', 'wii', 'game', 'think', 'would', 'make', 'splendid', 'time', 'especially', 'watch', 'movie', 'seen', 'cars', 'road', 'new', 'disney', 'series', 'starring', 'lightning', 'mcqueen', 'mater', 'focuses', 'cross', 'country', 'travels', 'seen', 'first', 'four', 'episodes', 'mater', 'would', 'humdingers', 'episodic', 'enjoy', 'nice', 'bowl', 'cereal', 'episode', 'go', 'wozniak', 'day', 'thanks', 'help', 'time', 'best', 'regards', 'bobby', 'williams']",hello bobby williams night closing must confess video brings warmth even fire could match thank scott blessing safety blanket world harm danger facial looking good always dug glasses keep ever considered making speed racer focused video perhaps wii game think would make splendid time especially watch movie seen cars road new disney series starring lightning mcqueen mater focuses cross country travels seen first four episodes mater would humdingers episodic enjoy nice bowl cereal episode wozniak day thanks help time best regards bobby williams
279,BuTTersChUnK McDonald's,"Yeah I’ll never forget that time when the court began tilting towards a 45 degree angle, Warping time and space & stuff. Legendary game.","yeah i’ll never forget that time when the court began tilting towards a 45 degree angle, warping time and space & stuff. legendary game.",2022-09-14T02:26:58Z,"['yeah', 'never', 'forget', 'time', 'court', 'began', 'tilting', 'towards', '45', 'degree', 'angle', 'warping', 'time', 'space', 'stuff', 'legendary', 'game']",yeah never forget time court began tilting towards degree angle warping time space stuff legendary game
280,TheSuperGuitarGuy,My favourite part was when the court tilted up at a 45 degree angle and underneath the wood was just bare rock.,my favourite part was when the court tilted up at a 45 degree angle and underneath the wood was just bare rock.,2022-09-14T02:02:31Z,"['favourite', 'part', 'court', 'tilted', '45', 'degree', 'angle', 'underneath', 'wood', 'bare', 'rock']",favourite part court tilted degree angle underneath wood bare rock
281,Edge Transit,"Ah yes, I remember that day when the entire court became slant from an earthquake. But how does that affect Lebrons legacy?","ah yes, i remember that day when the entire court became slant from an earthquake. but how does that affect lebrons legacy?",2022-09-14T01:00:41Z,"['ah', 'yes', 'remember', 'day', 'entire', 'court', 'became', 'slant', 'earthquake', 'affect', 'lebrons', 'legacy']",yes remember day entire court became slant earthquake affect lebrons legacy
282,Lucy Reed,My favorite crazy moment was when the Raptors were down 103-101 in Game 3 against the Celtics during the 2019-2020 season and Kyle Lowry threw a huge pass over Tacko Fall to OG Anunoby with 0.5 seconds left and OG made the three to win the game by one point,my favorite crazy moment was when the raptors were down 103-101 in game 3 against the celtics during the 2019-2020 season and kyle lowry threw a huge pass over tacko fall to og anunoby with 0.5 seconds left and og made the three to win the game by one point,2022-09-14T02:04:10Z,"['favorite', 'crazy', 'moment', 'raptors', '103', '101', 'game', '3', 'celtics', '2019', '2020', 'season', 'kyle', 'lowry', 'threw', 'huge', 'pass', 'tacko', 'fall', 'og', 'anunoby', '0', '5', 'seconds', 'left', 'og', 'made', 'three', 'win', 'game', 'one', 'point']",favorite crazy moment raptors 103 101 game celtics 2019 2020 season kyle lowry threw huge pass tacko fall anunoby seconds left made three win game one point
283,Adit Bhatia,It's crazy the work Rebound puts in. Its crazy he deserves the love.,it's crazy the work rebound puts in. its crazy he deserves the love.,2022-09-14T00:27:13Z,"['crazy', 'work', 'rebound', 'puts', 'crazy', 'deserves', 'love']",crazy work rebound puts crazy deserves love
284,Refill_2,"I have no idea why, but the commentator's reaction at 3:00 killed me 😂","i have no idea why, but the commentator's reaction at 3:00 killed me 😂",2022-09-14T02:57:05Z,"['idea', 'commentator', 'reaction', '3', '00', 'killed']",idea commentator reaction killed
285,Sockbot27,RIP Kobe. His death was a big reason why LA reacted that way in 2020. Felt like we won that one for him the year he passed .,rip kobe. his death was a big reason why la reacted that way in 2020. felt like we won that one for him the year he passed .,2022-09-14T01:40:08Z,"['rip', 'kobe', 'death', 'big', 'reason', 'la', 'reacted', 'way', '2020', 'felt', 'like', 'one', 'year', 'passed']",rip kobe death big reason reacted way 2020 felt like one year passed
286,snappingcrocodile816,Love these videos man. They are so entertaining and never fail to amaze me ❤️,love these videos man. they are so entertaining and never fail to amaze me ❤️,2022-09-14T00:27:10Z,"['love', 'videos', 'man', 'entertaining', 'never', 'fail', 'amaze']",love videos man entertaining never fail amaze
287,Andrew Bryant,"Ron Artest is so legendary that the actual craziest moment in NBA history, which he caused, is just a footnote in the video","ron artest is so legendary that the actual craziest moment in nba history, which he caused, is just a footnote in the video",2022-09-14T02:02:04Z,"['ron', 'artest', 'legendary', 'actual', 'craziest', 'moment', 'nba', 'history', 'caused', 'footnote', 'video']",ron artest legendary actual craziest moment nba history caused footnote video
288,Sim Drifter 69,"That 65ft shot was insane, he was practically on his own free throw line","that 65ft shot was insane, he was practically on his own free throw line",2022-09-14T10:50:39Z,"['65ft', 'shot', 'insane', 'practically', 'free', 'throw', 'line']",65ft shot insane practically free throw line
289,fmxda,I was fully expecting Tracy McGrady's 13 points in 33 seconds for the #1 spot.,i was fully expecting tracy mcgrady's 13 points in 33 seconds for the #1 spot.,2022-09-14T02:45:22Z,"['fully', 'expecting', 'tracy', 'mcgrady', '13', 'points', '33', 'seconds', '1', 'spot']",fully expecting tracy mcgrady points seconds spot
290,Ingram Prod.,"I loved the 2016 finals because when the cavs won, my friend that was a huge Steph curry fan was crying in the bathroom for a hour 💀","i loved the 2016 finals because when the cavs won, my friend that was a huge steph curry fan was crying in the bathroom for a hour 💀",2022-09-14T00:44:49Z,"['loved', '2016', 'finals', 'cavs', 'friend', 'huge', 'steph', 'curry', 'fan', 'crying', 'bathroom', 'hour']",loved 2016 finals cavs friend huge steph curry fan crying bathroom hour
291,Erix963,"""he's not gonna chase you down from behind and block you""

We all know how that turned out","""he's not gonna chase you down from behind and block you""

we all know how that turned out",2022-09-14T17:55:42Z,"['gonna', 'chase', 'behind', 'block', 'know', 'turned']",gonna chase behind block know turned
292,Papi Goldito Gaming,If I had a dollar every time he says “in NBA history” I love it 😂,if i had a dollar every time he says “in nba history” i love it 😂,2022-09-14T09:33:56Z,"['dollar', 'every', 'time', 'says', 'nba', 'history', 'love']",dollar every time says nba history love
293,rudy cruz,"I’ll never forget the lakers game when the whole arena tilted due to a massive earthquake.



Edit:Lebron proceeded to score a triple double with 60 pts and made Michaels flue game irrelevant.","i’ll never forget the lakers game when the whole arena tilted due to a massive earthquake.



edit:lebron proceeded to score a triple double with 60 pts and made michaels flue game irrelevant.",2022-09-14T01:17:30Z,"['never', 'forget', 'lakers', 'game', 'whole', 'arena', 'tilted', 'due', 'massive', 'earthquake', 'edit', 'lebron', 'proceeded', 'score', 'triple', 'double', '60', 'pts', 'made', 'michaels', 'flue', 'game', 'irrelevant']",never forget lakers game whole arena tilted due massive earthquake edit lebron proceeded score triple double pts made michaels flue game irrelevant
294,CaptainBaller2K,POV: You’re scrolling Through The comments And All You see is: “It’s always a Good day when Rebound Uploads” 💀💀💀,pov: you’re scrolling through the comments and all you see is: “it’s always a good day when rebound uploads” 💀💀💀,2022-09-14T00:48:22Z,"['pov', 'scrolling', 'comments', 'see', 'always', 'good', 'day', 'rebound', 'uploads']",pov scrolling comments see always good day rebound uploads
295,CRAZYASSASSIN,The best part is when half of the ground went up😲,the best part is when half of the ground went up😲,2022-09-14T00:30:13Z,"['best', 'part', 'half', 'ground', 'went']",best part half ground went
296,BelugaXE,You know it’s a good day when rebound posts 🔥,you know it’s a good day when rebound posts 🔥,2022-09-14T00:26:58Z,"['know', 'good', 'day', 'rebound', 'posts']",know good day rebound posts
297,Yello Jello Shorts,2:54 I died at this part 😂😂🤣🤣,2:54 i died at this part 😂😂🤣🤣,2022-09-15T00:54:45Z,"['2', '54', 'died', 'part']",died part
298,Willy Playz,"Yeah I’ll never forget that time when the court began tilting towards a 45 degree angle, Warping time and space & stuff. Legendary game.","yeah i’ll never forget that time when the court began tilting towards a 45 degree angle, warping time and space & stuff. legendary game.",2022-09-14T23:20:47Z,"['yeah', 'never', 'forget', 'time', 'court', 'began', 'tilting', 'towards', '45', 'degree', 'angle', 'warping', 'time', 'space', 'stuff', 'legendary', 'game']",yeah never forget time court began tilting towards degree angle warping time space stuff legendary game
299,Peter McKinnon,"What do you think? Interesting processing on the face. Skin looks too smooth? Hands look like they have more texture? Hmm. What do you all think? Pretty impressive regardless, FOR A PHONE! Hope you liked it!","what do you think? interesting processing on the face. skin looks too smooth? hands look like they have more texture? hmm. what do you all think? pretty impressive regardless, for a phone! hope you liked it!",2022-09-14T12:51:50Z,"['think', 'interesting', 'processing', 'face', 'skin', 'looks', 'smooth', 'hands', 'look', 'like', 'texture', 'hmm', 'think', 'pretty', 'impressive', 'regardless', 'phone', 'hope', 'liked']",think interesting processing face skin looks smooth hands look like texture hmm think pretty impressive regardless phone hope liked
300,Mudja,Literally didn't know it was an iPhone until Peter pointed it out. Amazing what phones can do for creators who are just starting out.,literally didn't know it was an iphone until peter pointed it out. amazing what phones can do for creators who are just starting out.,2022-09-14T13:11:14Z,"['literally', 'know', 'iphone', 'peter', 'pointed', 'amazing', 'phones', 'creators', 'starting']",literally know iphone peter pointed amazing phones creators starting
301,Rodrigo Contreras,"Was able to spot the image comparison immediately. There's this weird extra sharpening like effect with most phones when taking photos, where the very edges of objects, whether it be text or an outline of a shape etc., tends to get like ""blown out"" if that makes sense. It's most apparent in highlight areas or like the edges of the colored watch numbers and hands.
This Prores phone shoot also has this weird edge effect processing going on. Color wise it looked great, but that slight softness at times, like on your face, along with the odd extra edge blurrying especially on your body shape, make it quite noticeable to me it's not very ""pro camera"".","was able to spot the image comparison immediately. there's this weird extra sharpening like effect with most phones when taking photos, where the very edges of objects, whether it be text or an outline of a shape etc., tends to get like ""blown out"" if that makes sense. it's most apparent in highlight areas or like the edges of the colored watch numbers and hands.
this prores phone shoot also has this weird edge effect processing going on. color wise it looked great, but that slight softness at times, like on your face, along with the odd extra edge blurrying especially on your body shape, make it quite noticeable to me it's not very ""pro camera"".",2022-09-14T17:15:05Z,"['able', 'spot', 'image', 'comparison', 'immediately', 'weird', 'extra', 'sharpening', 'like', 'effect', 'phones', 'taking', 'photos', 'edges', 'objects', 'whether', 'text', 'outline', 'shape', 'etc', 'tends', 'get', 'like', 'blown', 'makes', 'sense', 'apparent', 'highlight', 'areas', 'like', 'edges', 'colored', 'watch', 'numbers', 'hands', 'prores', 'phone', 'shoot', 'also', 'weird', 'edge', 'effect', 'processing', 'going', 'color', 'wise', 'looked', 'great', 'slight', 'softness', 'times', 'like', 'face', 'along', 'odd', 'extra', 'edge', 'blurrying', 'especially', 'body', 'shape', 'make', 'quite', 'noticeable', 'pro', 'camera']",able spot image comparison immediately weird extra sharpening like effect phones taking photos edges objects whether text outline shape etc tends get like blown makes sense apparent highlight areas like edges colored watch numbers hands prores phone shoot also weird edge effect processing going color wise looked great slight softness times like face along odd extra edge blurrying especially body shape make quite noticeable pro camera
302,Evan Edinger,I mean I do think it was quite obvious which photo was which from the sharpness and dynamic range but then again can't compete against the R5 for that!,i mean i do think it was quite obvious which photo was which from the sharpness and dynamic range but then again can't compete against the r5 for that!,2022-09-15T12:54:45Z,"['mean', 'think', 'quite', 'obvious', 'photo', 'sharpness', 'dynamic', 'range', 'compete', 'r5']",mean think quite obvious photo sharpness dynamic range compete
303,Sidney Diongzon,Really interesting about not using Action Mode. Dope video Peter!,really interesting about not using action mode. dope video peter!,2022-09-14T15:28:36Z,"['really', 'interesting', 'using', 'action', 'mode', 'dope', 'video', 'peter']",really interesting using action mode dope video peter
304,SnowThirsty,"8:25 though, looks like dynamic frame rate creeped in, I remember spending hours in the HandBrake app in order to make it constant. Also it was so on point when Pete was asking “Is 4k good?” :) Love your work Peter, as always ❤️","8:25 though, looks like dynamic frame rate creeped in, i remember spending hours in the handbrake app in order to make it constant. also it was so on point when pete was asking “is 4k good?” :) love your work peter, as always ❤️",2022-09-14T22:41:35Z,"['8', '25', 'though', 'looks', 'like', 'dynamic', 'frame', 'rate', 'creeped', 'remember', 'spending', 'hours', 'handbrake', 'app', 'order', 'make', 'constant', 'also', 'point', 'pete', 'asking', '4k', 'good', 'love', 'work', 'peter', 'always']",though looks like dynamic frame rate creeped remember spending hours handbrake app order make constant also point pete asking good love work peter always
305,Zdenka Darula,yes I can see a difference 100% and it is a night and day compared to your usual set up. Even the photo had less detail and way too bright details on the watch. However it certainly got a bit better especially the stabilization... that is impressive.,yes i can see a difference 100% and it is a night and day compared to your usual set up. even the photo had less detail and way too bright details on the watch. however it certainly got a bit better especially the stabilization... that is impressive.,2022-09-14T13:55:42Z,"['yes', 'see', 'difference', '100', 'night', 'day', 'compared', 'usual', 'set', 'even', 'photo', 'less', 'detail', 'way', 'bright', 'details', 'watch', 'however', 'certainly', 'got', 'bit', 'better', 'especially', 'stabilization', 'impressive']",yes see difference 100 night day compared usual set even photo less detail way bright details watch however certainly got bit better especially stabilization impressive
306,Eric Seastrand,"I still cannot get over the pastel skin tones of the iPhone. And the oversaturated colors/lack of gradation. Even after color grading, there’s a certain cheapness to it that I can’t unsee.
But holy crap, it’s amazing what a phone can do these days. It’s still a joy to use. “The best camera is the one you have right now”","i still cannot get over the pastel skin tones of the iphone. and the oversaturated colors/lack of gradation. even after color grading, there’s a certain cheapness to it that i can’t unsee.
but holy crap, it’s amazing what a phone can do these days. it’s still a joy to use. “the best camera is the one you have right now”",2022-09-14T22:41:47Z,"['still', 'cannot', 'get', 'pastel', 'skin', 'tones', 'iphone', 'oversaturated', 'colors', 'lack', 'gradation', 'even', 'color', 'grading', 'certain', 'cheapness', 'unsee', 'holy', 'crap', 'amazing', 'phone', 'days', 'still', 'joy', 'use', 'best', 'camera', 'one', 'right']",still cannot get pastel skin tones iphone oversaturated colors lack gradation even color grading certain cheapness unsee holy crap amazing phone days still joy use best camera one right
307,GLG reviews,"Thanks for nice shots, my iPhone 14 pro max will come in october, my review can wait lol","thanks for nice shots, my iphone 14 pro max will come in october, my review can wait lol",2022-09-14T16:19:00Z,"['thanks', 'nice', 'shots', 'iphone', '14', 'pro', 'max', 'come', 'october', 'review', 'wait', 'lol']",thanks nice shots iphone pro max come october review wait lol
308,Jeffrey Dirkin,"I love watching peter do set design for product shots.  It feels like watching a true master at his craft, a Japanese blacksmith in the forge.  Well done","i love watching peter do set design for product shots.  it feels like watching a true master at his craft, a japanese blacksmith in the forge.  well done",2022-09-14T19:17:34Z,"['love', 'watching', 'peter', 'set', 'design', 'product', 'shots', 'feels', 'like', 'watching', 'true', 'master', 'craft', 'japanese', 'blacksmith', 'forge', 'well', 'done']",love watching peter set design product shots feels like watching true master craft japanese blacksmith forge well done
309,Marquis M,"We've gotten to a point where phone cameras have become the go to point shoot camera now, especially for vlogs.  This is the perfect time for anyone who wants to dip their toes in content creation.  It's not going to be on the same level as a cinema camera or a mirrorless, but man is it a great way to learn the fundamentals and basics on!","we've gotten to a point where phone cameras have become the go to point shoot camera now, especially for vlogs.  this is the perfect time for anyone who wants to dip their toes in content creation.  it's not going to be on the same level as a cinema camera or a mirrorless, but man is it a great way to learn the fundamentals and basics on!",2022-09-14T16:14:51Z,"['gotten', 'point', 'phone', 'cameras', 'become', 'go', 'point', 'shoot', 'camera', 'especially', 'vlogs', 'perfect', 'time', 'anyone', 'wants', 'dip', 'toes', 'content', 'creation', 'going', 'level', 'cinema', 'camera', 'mirrorless', 'man', 'great', 'way', 'learn', 'fundamentals', 'basics']",gotten point phone cameras become point shoot camera especially vlogs perfect time anyone wants dip toes content creation going level cinema camera mirrorless man great way learn fundamentals basics
310,Ron Paulk,"Peter, you and your content are soooo good. I never miss your posts😎🤙","peter, you and your content are soooo good. i never miss your posts😎🤙",2022-09-14T13:25:07Z,"['peter', 'content', 'soooo', 'good', 'never', 'miss', 'posts']",peter content soooo good never miss posts
311,brickanics,"I honestly thought the R5 crushed the iPhone in your example, but obviously, the phones keep getting better and better. Great video as always Pete!","i honestly thought the r5 crushed the iphone in your example, but obviously, the phones keep getting better and better. great video as always pete!",2022-09-14T18:03:39Z,"['honestly', 'thought', 'r5', 'crushed', 'iphone', 'example', 'obviously', 'phones', 'keep', 'getting', 'better', 'better', 'great', 'video', 'always', 'pete']",honestly thought crushed iphone example obviously phones keep getting better better great video always pete
312,Elliot Marks,"One IMPORTANT thing to notice is that this video was shot in a studio environment, and edited by a professional editor. I am SO impressed with the strides mobile cameras have been making lately, but it is truly in the rough scenarios where real cameras tend to shine.","one important thing to notice is that this video was shot in a studio environment, and edited by a professional editor. i am so impressed with the strides mobile cameras have been making lately, but it is truly in the rough scenarios where real cameras tend to shine.",2022-09-15T00:57:30Z,"['one', 'important', 'thing', 'notice', 'video', 'shot', 'studio', 'environment', 'edited', 'professional', 'editor', 'impressed', 'strides', 'mobile', 'cameras', 'making', 'lately', 'truly', 'rough', 'scenarios', 'real', 'cameras', 'tend', 'shine']",one important thing notice video shot studio environment edited professional editor impressed strides mobile cameras making lately truly rough scenarios real cameras tend shine
313,Mirza Perumbath,"For someone taking photos with a camera, the differences are pretty clear (especially the softness on edges for cinematic videos and heavy shrpening), but that being said phones definetly have much better cameras and software tricks.","for someone taking photos with a camera, the differences are pretty clear (especially the softness on edges for cinematic videos and heavy shrpening), but that being said phones definetly have much better cameras and software tricks.",2022-09-15T04:13:09Z,"['someone', 'taking', 'photos', 'camera', 'differences', 'pretty', 'clear', 'especially', 'softness', 'edges', 'cinematic', 'videos', 'heavy', 'shrpening', 'said', 'phones', 'definetly', 'much', 'better', 'cameras', 'software', 'tricks']",someone taking photos camera differences pretty clear especially softness edges cinematic videos heavy shrpening said phones definetly much better cameras software tricks
314,Life to go,Is there still the lens flare problem with the 14 Pro / Max?,is there still the lens flare problem with the 14 pro / max?,2022-09-15T00:41:10Z,"['still', 'lens', 'flare', 'problem', '14', 'pro', 'max']",still lens flare problem pro max
315,Creative Ryan,This looks too good!! It’s scary 😆,this looks too good!! it’s scary 😆,2022-09-15T03:29:04Z,"['looks', 'good', 'scary']",looks good scary
